{"v":1,"agent":"opencode","event":"permission.asked","tsMs":1791282000000,"receivedAt":"2026-10-06T09:00:00.000Z",
 "hookPid":7321,"parentPid":7300,"processChain":[{"pid":7300,"name":"opencode.exe"},{"pid":7200,"name":"pwsh.exe"}],
 "payload":{"sessionId":"ses_0a1b2c3d4e5fOpenCodeTest","tool":"shell","canAlways":true,"cwd":"C:/src/delta","command":"git push --force"}}
